{
  "goal_id": "m7-context-budget-report",
  "goal": "Expose prompt-budget usage by layer through explicit memory-aware context accounting.",
  "input_mode": "text_line",
  "input_payload": "Report context budget by layer.",
  "fixture": {
    "source_asset": "source.md"
  },
  "expect": {
    "boot_prompt": "Goal >",
    "timeout_sec": 30,
    "result_required": false,
    "required_trace_events": [
      "session_started",
      "user_turn_received",
      "model_turn_started",
      "tool_call_requested",
      "tool_call_completed",
      "assistant_response_rendered",
      "loop_stopped",
      "goal_completed"
    ],
    "session_transcript_required": true,
    "expected_turn_count": 1,
    "terminal_result_required": true,
    "terminal_fields": [
      "status",
      "summary"
    ],
    "terminal_status": "ok",
    "terminal_summary_must_include": [
      "Context budget recorded instructions",
      "latest tool result"
    ],
    "expected_tool_calls": [
      {
        "event": "tool_call_requested",
        "tool": "memory_status"
      }
    ],
    "max_tool_calls": 1,
    "memory_snapshot_required": true,
    "memory_entry_count": 3,
    "expected_memory_entries": [
      {
        "kind": "task"
      },
      {
        "kind": "execution"
      },
      {
        "kind": "conversation"
      }
    ],
    "context_snapshot_required": true,
    "context_turn_count": 1,
    "required_context_sections": [
      "Current request",
      "Latest tool result",
      "Working memory"
    ],
    "context_budget_required": true,
    "context_budget_turn_count": 1,
    "required_context_budget_fields": [
      "instructions_chars",
      "current_request_chars",
      "latest_tool_result_chars",
      "working_memory_chars",
      "estimated_total_tokens"
    ]
  }
}
