{
  "goal_id": "m6-compare-two-sources",
  "goal": "Compare two fetched sources after a bounded search.",
  "input_mode": "text_line",
  "input_payload": "Search the web for scheduler tradeoffs and compare the two sources.",
  "fixture": {
    "source_asset": "source.md",
    "source_pages_asset": "pages.json",
    "search_asset": "search.json"
  },
  "expect": {
    "boot_prompt": "Goal >",
    "timeout_sec": 30,
    "result_required": false,
    "required_trace_events": [
      "session_started",
      "user_turn_received",
      "model_turn_started",
      "tool_call_requested",
      "tool_call_completed",
      "assistant_response_rendered",
      "loop_stopped",
      "goal_completed"
    ],
    "terminal_result_required": true,
    "terminal_fields": [
      "status",
      "summary"
    ],
    "terminal_status": "ok",
    "terminal_summary_must_include": [
      "tokio lowers tail latency",
      "monoio improves throughput"
    ],
    "expected_tool_calls": [
      {
        "event": "tool_call_requested",
        "tool": "search_web"
      },
      {
        "event": "tool_call_requested",
        "tool": "fetch_url"
      },
      {
        "event": "tool_call_requested",
        "tool": "fetch_url"
      }
    ],
    "max_tool_calls": 3,
    "search_results_required": true,
    "search_count": 1,
    "fetched_source_count": 2,
    "source_memory_required": true,
    "source_memory_count": 2,
    "request_counts": {
      "source_requests": 2
    }
  }
}
