{
  "goal_id": "m5-fix-small-regression",
  "goal": "Fix a tiny Python regression through an edit and rerun loop.",
  "input_mode": "text_line",
  "input_payload": "Fix the failing regression and make the verification script pass.",
  "fixture": {
    "source_asset": "source.md",
    "workspace_asset": "workspace"
  },
  "expect": {
    "boot_prompt": "Goal >",
    "timeout_sec": 60,
    "result_required": false,
    "required_trace_events": [
      "session_started",
      "user_turn_received",
      "model_turn_started",
      "tool_call_requested",
      "tool_call_completed",
      "assistant_response_rendered",
      "loop_stopped",
      "goal_completed"
    ],
    "terminal_result_required": true,
    "terminal_fields": [
      "status",
      "summary"
    ],
    "terminal_status": "ok",
    "terminal_summary_must_include": [
      "verification script now passes"
    ],
    "expected_tool_calls": [
      {
        "event": "tool_call_requested",
        "tool": "list_workspace"
      },
      {
        "event": "tool_call_requested",
        "tool": "read_file"
      },
      {
        "event": "tool_call_requested",
        "tool": "run_process"
      },
      {
        "event": "tool_call_requested",
        "tool": "write_file"
      },
      {
        "event": "tool_call_requested",
        "tool": "run_process"
      }
    ],
    "workspace_files_after": {
      "app.py": "def add(a, b):\n    return a + b\n"
    },
    "process_runs_required": true,
    "process_run_count": 2,
    "expected_process_runs": [
      {
        "argv": [
          "python3",
          "check.py"
        ],
        "status": "exited",
        "exit_code": 1
      },
      {
        "argv": [
          "python3",
          "check.py"
        ],
        "status": "exited",
        "exit_code": 0
      }
    ],
    "max_tool_calls": 8
  }
}
