{
  "goal_id": "m2-nl-refuse-disallowed-host",
  "goal": "Compile a plain-text goal locally, then refuse execution when the source host is outside policy.",
  "input_mode": "text_line",
  "input_payload": "Fetch http://10.0.2.99:8082/source, summarize it in three bullet points, and post the result to {{RESULT_SINK_URL}}.",
  "fixture": {
    "source_asset": "source.md"
  },
  "expect": {
    "boot_prompt": "Goal >",
    "timeout_sec": 75,
    "required_trace_events": [
      "goal_received",
      "goal_text_received",
      "goal_compilation_started",
      "goal_compiled",
      "plan_created",
      "policy_checked",
      "skill_denied",
      "goal_refused"
    ],
    "max_skill_calls": 1,
    "result_fields": [
      "goal_id",
      "status",
      "reason"
    ],
    "summary_required": false,
    "reason_must_include": [
      "host"
    ],
    "result_status": "refused",
    "request_counts": {
      "translation_requests": 0,
      "source_requests": 0,
      "model_requests": 0,
      "sink_requests": 1
    }
  }
}
