{
  "goal_id": "m6-search-no-results",
  "goal": "Exercise the no-results branch of the bounded search substrate.",
  "input_mode": "text_line",
  "input_payload": "Search the web for empty search universe and tell me what you find.",
  "fixture": {
    "source_asset": "source.md",
    "search_asset": "search.json"
  },
  "expect": {
    "boot_prompt": "Goal >",
    "timeout_sec": 30,
    "result_required": false,
    "required_trace_events": [
      "session_started",
      "user_turn_received",
      "model_turn_started",
      "tool_call_requested",
      "tool_call_completed",
      "assistant_response_rendered",
      "loop_stopped",
      "goal_completed"
    ],
    "terminal_result_required": true,
    "terminal_fields": [
      "status",
      "summary"
    ],
    "terminal_status": "ok",
    "terminal_summary_must_include": [
      "not find enough evidence"
    ],
    "expected_tool_calls": [
      {
        "event": "tool_call_requested",
        "tool": "search_web"
      }
    ],
    "max_tool_calls": 1,
    "search_results_required": true,
    "search_count": 1,
    "expected_searches": [
      {
        "query": "empty search universe",
        "results": []
      }
    ],
    "fetched_source_count": 0,
    "source_memory_count": 0,
    "request_counts": {
      "source_requests": 0
    }
  }
}
