{
  "goal_id": "m7-memory-inspection",
  "goal": "Inspect explicit working memory and verify that the runtime exposes retained state directly.",
  "input_mode": "text_line",
  "input_payload": "Inspect memory and report what is stored.",
  "fixture": {
    "source_asset": "source.md"
  },
  "expect": {
    "boot_prompt": "Goal >",
    "timeout_sec": 30,
    "result_required": false,
    "required_trace_events": [
      "session_started",
      "user_turn_received",
      "model_turn_started",
      "tool_call_requested",
      "tool_call_completed",
      "assistant_response_rendered",
      "loop_stopped",
      "goal_completed"
    ],
    "session_transcript_required": true,
    "expected_turn_count": 1,
    "terminal_result_required": true,
    "terminal_fields": [
      "status",
      "summary"
    ],
    "terminal_status": "ok",
    "terminal_summary_must_include": [
      "task entry",
      "source entry"
    ],
    "expected_tool_calls": [
      {
        "event": "tool_call_requested",
        "tool": "memory_status"
      },
      {
        "event": "tool_call_requested",
        "tool": "list_memory"
      },
      {
        "event": "tool_call_requested",
        "tool": "read_memory"
      }
    ],
    "max_tool_calls": 3,
    "memory_snapshot_required": true,
    "memory_entry_count": 3,
    "expected_memory_entries": [
      {
        "kind": "task"
      },
      {
        "kind": "source"
      },
      {
        "kind": "conversation"
      }
    ],
    "memory_events_required": true,
    "memory_event_count": 3,
    "context_snapshot_required": true,
    "context_turn_count": 1,
    "required_context_sections": [
      "Current request",
      "Working memory",
      "Known sources",
      "Recent conversation"
    ],
    "context_budget_required": true,
    "context_budget_turn_count": 1,
    "required_context_budget_fields": [
      "instructions_chars",
      "current_request_chars",
      "working_memory_chars",
      "known_sources_chars",
      "recent_conversation_chars",
      "estimated_total_tokens"
    ]
  }
}
