{
  "goal_id": "m7-coding-memory-followup",
  "goal": "Retain bounded coding state and answer a follow-up question about the earlier failure.",
  "turns": [
    {
      "input_mode": "text_line",
      "input_payload": "Remember the failing coding result."
    },
    {
      "input_mode": "text_line",
      "input_payload": "What was the bug?"
    }
  ],
  "fixture": {
    "source_asset": "source.md"
  },
  "expect": {
    "boot_prompt": "Goal >",
    "timeout_sec": 30,
    "result_required": false,
    "required_trace_events": [
      "session_started",
      "user_turn_received",
      "model_turn_started",
      "tool_call_requested",
      "tool_call_completed",
      "assistant_response_rendered",
      "loop_stopped",
      "goal_completed"
    ],
    "session_transcript_required": true,
    "expected_turn_count": 2,
    "terminal_result_required": true,
    "terminal_fields": [
      "status",
      "summary"
    ],
    "terminal_status": "ok",
    "terminal_summary_must_include": [
      "add(a, b) returned a - b"
    ],
    "expected_tool_calls": [
      {
        "event": "tool_call_requested",
        "tool": "memory_status"
      },
      {
        "event": "tool_call_requested",
        "tool": "read_memory"
      }
    ],
    "max_tool_calls": 3,
    "memory_snapshot_required": true,
    "memory_entry_count": 4,
    "expected_memory_entries": [
      {
        "kind": "task"
      },
      {
        "id": "mem-workspace-coding",
        "kind": "workspace"
      },
      {
        "id": "mem-exec-coding",
        "kind": "execution"
      },
      {
        "kind": "conversation"
      }
    ],
    "memory_events_required": true,
    "context_snapshot_required": true,
    "context_turn_count": 2,
    "required_context_sections": [
      "Current request",
      "Working memory",
      "Workspace memory",
      "Recent conversation"
    ],
    "context_budget_required": true,
    "context_budget_turn_count": 2
  }
}
